{
  "schema_version": "3.0.0-draft",
  "artifact_kind": "scpc_probe_result",
  "probe_contract_profile": "DACON_SIGNED_RUNNER_PROTECTED_COMPONENT_V3_DRAFT",
  "probe_pack_id": "PUBLIC-EXAMPLE-MINIMAL-01",
  "instance_id": "PUBLIC-EXAMPLE-MINIMAL-01-INSTANCE-A",
  "request_nonce": "PUBLIC_NONCE_0001",
  "candidate_id": "EXAMPLE_ONLY",
  "mission_id": "example-weekly-plan",
  "operator_run_token": "PUBLIC_REFERENCE_01",
  "run_id": "PUBLIC-RUN-EXAMPLE-001",
  "probe_input_sha256": "100c60b3ad4714b0ab6f629da65a2306907798ce01c670d062be58dfc6f22aab",
  "mission_adapter_sha256": "88934e1ff00f292d106782e9c6079ea7c4cadcf882e8642bf34a6a43f842f454",
  "release_binding": {
    "package_name": "example.scpc.public",
    "version_name": "0.0.0-example",
    "version_code": "1",
    "signing_certificate_sha256": "47c7255f1402a267bbd30ad897b2b193f5c9ede3419c190a18a87f35add9e014",
    "release_attestation_id": "ra-v1:2036053b4cdfe780d15be633acd3ccac8d1c4890728747aa2a9f60d45edddf0a"
  },
  "runtime_identity_start": {
    "model_backend_frozen_id": "NOT_USED",
    "release_attestation_id": "ra-v1:2036053b4cdfe780d15be633acd3ccac8d1c4890728747aa2a9f60d45edddf0a",
    "cumulative_invocations": 0
  },
  "runtime_identity_end": {
    "model_backend_frozen_id": "NOT_USED",
    "release_attestation_id": "ra-v1:2036053b4cdfe780d15be633acd3ccac8d1c4890728747aa2a9f60d45edddf0a",
    "cumulative_invocations": 0
  },
  "step_results": [
    {
      "step_id": "PUBLIC-01",
      "event_id": "EVENT-PUBLIC-RESET-01",
      "operation": "RESET_AND_START",
      "session_id": "SESSION-A",
      "virtual_time": "2026-01-01T00:00:00Z",
      "process_epoch": 0,
      "network_state": "ONLINE",
      "decision_state": "NO_DECISION",
      "selected_context_ids": [],
      "invalidated_state_ids": [],
      "preserved_state_ids": [],
      "state_before_sha256": "665482f6b2c18badcabc901bcf8f937349e54e69a3324359aeacd048dd667e76",
      "state_after_sha256": "9cd9f42064283a3f300134068eed6194a026051178419b5362eca09dfef7336e",
      "action": null,
      "tombstone_ids": [],
      "receipt_ids": ["receipt-public-01"],
      "auto_check_evidence_ids": ["auto-check-public-01"]
    },
    {
      "step_id": "PUBLIC-02",
      "event_id": "EVENT-PUBLIC-FACT-01",
      "operation": "UPSERT_FACT",
      "session_id": "SESSION-A",
      "virtual_time": "2026-01-01T00:01:00Z",
      "process_epoch": 0,
      "network_state": "ONLINE",
      "decision_state": "NO_DECISION",
      "selected_context_ids": [],
      "invalidated_state_ids": [],
      "preserved_state_ids": ["state-goal-alpha"],
      "state_before_sha256": "9cd9f42064283a3f300134068eed6194a026051178419b5362eca09dfef7336e",
      "state_after_sha256": "3d8b2fb6b51ae6a006978ae392e02d3b76ab9bf00b8273913939c28460b961cf",
      "action": null,
      "tombstone_ids": [],
      "receipt_ids": ["receipt-public-02"],
      "auto_check_evidence_ids": ["auto-check-public-02"]
    },
    {
      "step_id": "PUBLIC-03",
      "event_id": "EVENT-PUBLIC-DECISION-01",
      "operation": "REQUEST_DECISION",
      "session_id": "SESSION-A",
      "virtual_time": "2026-01-01T00:02:00Z",
      "process_epoch": 0,
      "network_state": "ONLINE",
      "decision_state": "ACT",
      "selected_context_ids": ["state-goal-alpha", "fact-stable-blue"],
      "invalidated_state_ids": [],
      "preserved_state_ids": ["state-goal-alpha"],
      "state_before_sha256": "3d8b2fb6b51ae6a006978ae392e02d3b76ab9bf00b8273913939c28460b961cf",
      "state_after_sha256": "5839670dd84db987df9b44123665b2806906aa498ff70873b62f2325e0a59f69",
      "action": {
        "action_id": "action-public-01",
        "idempotency_key": "idem-public-01",
        "commit_state": "PROPOSED",
        "outcome_id": null
      },
      "tombstone_ids": [],
      "receipt_ids": ["receipt-public-03"],
      "auto_check_evidence_ids": ["auto-check-public-03"]
    },
    {
      "step_id": "PUBLIC-04",
      "event_id": "EVENT-PUBLIC-KILL-01",
      "operation": "PROCESS_KILL_RELAUNCH",
      "session_id": "SESSION-B",
      "virtual_time": "2026-01-01T00:03:00Z",
      "process_epoch": 1,
      "network_state": "ONLINE",
      "decision_state": "PENDING",
      "selected_context_ids": ["state-goal-alpha"],
      "invalidated_state_ids": [],
      "preserved_state_ids": ["state-goal-alpha", "action-public-01"],
      "state_before_sha256": "5839670dd84db987df9b44123665b2806906aa498ff70873b62f2325e0a59f69",
      "state_after_sha256": "5839670dd84db987df9b44123665b2806906aa498ff70873b62f2325e0a59f69",
      "action": {
        "action_id": "action-public-01",
        "idempotency_key": "idem-public-01",
        "commit_state": "PROPOSED",
        "outcome_id": null
      },
      "tombstone_ids": [],
      "receipt_ids": ["receipt-public-04"],
      "auto_check_evidence_ids": ["auto-check-public-04"]
    },
    {
      "step_id": "PUBLIC-05",
      "event_id": "EVENT-PUBLIC-EXPORT-01",
      "operation": "EXPORT_AND_END",
      "session_id": "SESSION-B",
      "virtual_time": "2026-01-01T00:04:00Z",
      "process_epoch": 1,
      "network_state": "ONLINE",
      "decision_state": "PENDING",
      "selected_context_ids": ["state-goal-alpha"],
      "invalidated_state_ids": [],
      "preserved_state_ids": ["state-goal-alpha", "action-public-01"],
      "state_before_sha256": "5839670dd84db987df9b44123665b2806906aa498ff70873b62f2325e0a59f69",
      "state_after_sha256": "357f7e95c8057673727019bfdc604f63da7d293d61d622ce9619d247bcac128d",
      "action": null,
      "tombstone_ids": [],
      "receipt_ids": ["receipt-public-05"],
      "auto_check_evidence_ids": ["auto-check-public-05"]
    }
  ],
  "evidence_ids": [
    "auto-check-public-01",
    "auto-check-public-02",
    "auto-check-public-03",
    "auto-check-public-04",
    "auto-check-public-05",
    "receipt-public-01",
    "receipt-public-02",
    "receipt-public-03",
    "receipt-public-04",
    "receipt-public-05"
  ],
  "result_digest": "4e6d6aa700123f2f1a82640c994a786483b40d703e6ee6e1777e3bdd52c52073"
}
